{
  "matrix_id": "robotics_simulation_runtime_profiles",
  "version_date": "2026-07-05",
  "policy": {
    "public_scope": "Reusable infrastructure for robotics simulation, runtime checks, data capture, and integration boundaries.",
    "product_logic": "out_of_scope",
    "version_line": "ubuntu_24_04_ros2_jazzy_gazebo_harmonic",
    "default_gpu_required": false
  },
  "profiles": {
    "core_simulation": {
      "status": "ready",
      "purpose": "Base containerized simulation runtime for local and CI checks.",
      "release_gate": true,
      "compose_profiles": [],
      "host": {
        "os": [
          "windows_11_wsl2",
          "linux"
        ],
        "container_runtime": "docker",
        "gpu_required": false
      },
      "capabilities": [
        {
          "id": "ros2_runtime",
          "category": "middleware",
          "components": [
            "ubuntu_24_04_noble",
            "ros2_jazzy"
          ]
        },
        {
          "id": "gazebo_runtime",
          "category": "simulation",
          "components": [
            "gazebo_harmonic",
            "ros_gz",
            "ros_gz_bridge",
            "ros_gz_sim"
          ]
        }
      ],
      "checks": [
        {
          "id": "build_image",
          "command": "make compose-build",
          "required": true
        },
        {
          "id": "smoke_image",
          "command": "make compose-smoke",
          "required": true
        }
      ],
      "artifacts": [
        "artifacts/reports/compose-smoke.txt",
        "artifacts/reports/docker-image-inspect.json"
      ]
    },
    "autopilot_sitl": {
      "status": "partial",
      "purpose": "Autopilot-oriented simulation readiness through standard MAVLink and ROS interfaces.",
      "release_gate": true,
      "compose_profiles": [
        "autopilot"
      ],
      "host": {
        "os": [
          "windows_11_wsl2",
          "linux"
        ],
        "container_runtime": "docker",
        "gpu_required": false
      },
      "capabilities": [
        {
          "id": "mavlink_bridge",
          "category": "autopilot",
          "components": [
            "mavlink",
            "mavros",
            "mavros_extras",
            "mavros_msgs"
          ]
        },
        {
          "id": "sitl_base",
          "category": "autopilot",
          "components": [
            "ardupilot_dev_base"
          ],
          "notes": [
            "The default release gate covers package and base image readiness; full vehicle behavior checks and concrete vehicle scenarios belong to higher-level test suites."
          ]
        }
      ],
      "checks": [
        {
          "id": "mavros_packages",
          "command": "make compose-smoke",
          "required": true
        },
        {
          "id": "upstream_image_manifests",
          "command": "make docker-manifests",
          "required": true
        },
        {
          "id": "ardupilot_base_smoke",
          "command": "make compose-ardupilot-smoke",
          "required": true
        }
      ],
      "artifacts": [
        "artifacts/reports/compose-autopilot-smoke.txt",
        "artifacts/reports/ardupilot-base-image.txt"
      ]
    },
    "px4_sitl_runtime": {
      "status": "optional",
      "purpose": "Optional PX4 SITL runtime probe kept outside release gates while the selected image tag is not a stable release line.",
      "release_gate": false,
      "compose_profiles": [
        "px4"
      ],
      "host": {
        "os": [
          "windows_11_wsl2",
          "linux"
        ],
        "container_runtime": "docker",
        "gpu_required": false
      },
      "capabilities": [
        {
          "id": "px4_sitl_runtime",
          "category": "autopilot",
          "components": [
            "px4_sitl_gazebo"
          ],
          "notes": [
            "This repository validates runtime availability only; vehicle models, missions, and behavior checks belong to upper projects."
          ]
        }
      ],
      "checks": [
        {
          "id": "px4_runtime_smoke",
          "command": "make compose-px4-smoke",
          "required": false
        }
      ],
      "artifacts": [
        "artifacts/reports/compose-px4-smoke.txt"
      ]
    },
    "dds_bridge": {
      "status": "optional",
      "purpose": "Optional DDS bridge runtime for autopilot and ROS 2 integration checks.",
      "release_gate": false,
      "compose_profiles": [
        "dds"
      ],
      "host": {
        "os": [
          "windows_11_wsl2",
          "linux"
        ],
        "container_runtime": "docker",
        "gpu_required": false
      },
      "capabilities": [
        {
          "id": "micro_xrce_dds_agent",
          "category": "communication",
          "components": [
            "micro_xrce_dds_agent"
          ]
        },
        {
          "id": "dds_interface_package_boundary",
          "category": "communication",
          "components": [
            "external_message_packages",
            "dds_topics"
          ],
          "notes": [
            "Message package ownership remains with the upper project."
          ]
        }
      ],
      "checks": [
        {
          "id": "dds_agent_help",
          "command": "make compose-dds-smoke",
          "required": false
        }
      ],
      "artifacts": [
        "artifacts/reports/compose-dds-smoke.txt"
      ]
    },
    "comms_bridge": {
      "status": "optional",
      "purpose": "Optional ROS 2 communication bridge runtime for distributed simulation checks.",
      "release_gate": false,
      "compose_profiles": [
        "comms"
      ],
      "host": {
        "os": [
          "windows_11_wsl2",
          "linux"
        ],
        "container_runtime": "docker",
        "gpu_required": false
      },
      "capabilities": [
        {
          "id": "zenoh_ros2_bridge",
          "category": "communication",
          "components": [
            "zenoh_bridge_ros2dds"
          ]
        }
      ],
      "checks": [
        {
          "id": "zenoh_bridge_help",
          "command": "make compose-comms-smoke",
          "required": false
        }
      ],
      "artifacts": [
        "artifacts/reports/compose-comms-smoke.txt"
      ]
    },
    "manipulator_control": {
      "status": "ready",
      "purpose": "Generic planning and controller readiness for robotic manipulators and actuated mechanisms.",
      "release_gate": true,
      "compose_profiles": [],
      "host": {
        "os": [
          "windows_11_wsl2",
          "linux"
        ],
        "container_runtime": "docker",
        "gpu_required": false
      },
      "capabilities": [
        {
          "id": "motion_planning",
          "category": "control",
          "components": [
            "moveit",
            "moveit_ros_move_group"
          ]
        },
        {
          "id": "controller_framework",
          "category": "control",
          "components": [
            "ros2_control",
            "ros2_controllers",
            "controller_manager",
            "joint_trajectory_controller",
            "ros2controlcli"
          ]
        }
      ],
      "checks": [
        {
          "id": "control_packages",
          "command": "make compose-smoke",
          "required": true
        }
      ],
      "artifacts": [
        "artifacts/reports/compose-smoke.txt"
      ]
    },
    "perception_runtime": {
      "status": "partial",
      "purpose": "Replaceable machine perception runtime boundary without embedding application-specific models.",
      "release_gate": true,
      "compose_profiles": [],
      "host": {
        "os": [
          "windows_11_wsl2",
          "linux"
        ],
        "container_runtime": "docker",
        "gpu_required": false
      },
      "capabilities": [
        {
          "id": "opencv_bridge",
          "category": "perception",
          "components": [
            "python3_opencv",
            "cv_bridge",
            "vision_opencv",
            "image_transport"
          ]
        },
        {
          "id": "replaceable_provider",
          "category": "perception",
          "components": [
            "ros_topics",
            "model_artifact_manifest",
            "runtime_specific_adapter"
          ],
          "notes": [
            "Provider implementation and model quality are outside the infrastructure repository."
          ]
        }
      ],
      "checks": [
        {
          "id": "opencv_import",
          "command": "make compose-smoke",
          "required": true
        }
      ],
      "artifacts": [
        "artifacts/reports/compose-smoke.txt"
      ]
    },
    "sensor_simulation": {
      "status": "partial",
      "purpose": "Standard ROS sensor interface readiness for camera, depth, point cloud, and frame streams.",
      "release_gate": true,
      "compose_profiles": [],
      "host": {
        "os": [
          "windows_11_wsl2",
          "linux"
        ],
        "container_runtime": "docker",
        "gpu_required": false
      },
      "capabilities": [
        {
          "id": "camera_streams",
          "category": "sensors",
          "components": [
            "sensor_msgs_image",
            "camera_info",
            "image_transport"
          ],
          "notes": [
            "The infrastructure validates message and transport interfaces, not product-specific camera scenes."
          ]
        },
        {
          "id": "range_streams",
          "category": "sensors",
          "components": [
            "sensor_msgs_pointcloud2",
            "depth_image",
            "tf_frames"
          ],
          "notes": [
            "Concrete sensor models, world files, and perception scenarios remain owned by upper projects."
          ]
        }
      ],
      "checks": [
        {
          "id": "sensor_interfaces",
          "command": "make compose-sensor-smoke",
          "required": true
        },
        {